ISBN,Título,Resumo,Imagem_Lisboa,Autor_Beja,Publicacao_Beja,Colecao_Beja,Assuntos_Beja,CDU_Beja
978-989-8166-01-2,Eu espero...,,http://catalogolxi.cm-lisboa.pt/images/winlibimg.aspx?skey=&/winlibimg.aspx?skey=&doc=303083&img=2225&res=150&thb=1&pag=1,"Cali, Davide, 1972-;Bloch, Serge, 1956-, il.;Gouveia, Miguel, 1962-, trad.","[S.l.] : Bruaá, 2008",,Literatura Suiça,087.5(0-5)
978-84-17440-79-4,Uma pequena semente,"Com recurso ao formato do livro-acordeão, este álbum conta uma narrativa circular cujo final é apenas um regresso ao princípio, em estreita ligação com os ciclos da natureza. O tema da germinação das sementes e da sua transformação em árvores, habitat de mais espécies, que darão origem a outras sementes é habilmente explorado com recurso a um design que tira partido do jogo de cores e do formato do livro.[Resumo da responsabilidade do Plano Nacional de Leitura 2027]",http://catalogolxi.cm-lisboa.pt/images/winlibimg.aspx?skey=&doc=511631&img=55751&res=100&thb=1&pag=1,"Benegas, Mar, 1975-;Caamaño, Neus, 1984-, il.;Castel-Branco, Inês, 1977-, trad.","Barcelona : Akiara Books, 2020",Akipoeta ; 3,Literatura Espanhola,087.5(5-10)
978-989-564-346-2,Ser pequeno na cidade,"Pode ser um pouco assustador estarmos sós na grande cidade. Há sempre movimento, muito barulho, pessoas que andam apressadas, animais e lugares que nos metem medo... Mas há sempre uma maneira de chegarmos tranquilos e seguros a um lugar onde sempre nos esperam.[Resumo da responsabilidade do Plano Nacional de Leitura 2027]",http://catalogolxi.cm-lisboa.pt/images/winlibimg.aspx?skey=&doc=511854&img=55874&res=100&thb=1&pag=1,"Smith, Sydney, 1980-;Ferreira, Susana Cardoso, 1972-, trad.","Amadora : Fábula, 2021",,Literatura Canadiana,087.5(5-10)
978-84-17440-85-5,Do outro lado,"Este livro-álbum conta a história de Juan José, uma criança sonhadora a quem a realidade, por muito dura e difícil, não rouba a capacidade de sonhar. Num contexto adverso, onde até a deslocação para a escolonhara se transforma numa enorme aventura, a capacidade de sonhar parece funcionar como uma resistência contra a pobreza e a desigualdade. O livro conta com excelentes ilustrações que contextuariam e complementam a história[Resumo da responsabilidade do Plano Nacional de Leitura 2027]",http://catalogolxi.cm-lisboa.pt/images/winlibimg.aspx?skey=&doc=512010&img=61732&res=100&thb=1&pag=1,"Falcón Maldonado, Cristina, 1963-;Cabassa, Mariona, 1977-, il.;Sacramento, Mariona, trad.","Barcelona : Akiara Books,",Akialbum ; 19,Literatura Venezuelana,087.5(5-10)
978-989-54738-2-3,Discórdia,"Com recurso apenas a imagens, este livro-álbum sem texto conta a história de como nascem e crescem as discussões e as discórdias, avolumando-se até limites impensáveis. Só com algum esforço, imaginação, colaboração e entreajuda é possível encontrar soluções para ultrapassar as diferenças, construindo um mundo onde várias opiniões possam ter lugar.[Resumo da responsabilidade do Plano Nacional de Leitura 2027]",http://catalogolxi.cm-lisboa.pt/images/winlibimg.aspx?skey=&doc=513058&img=56774&res=100&thb=1&pag=1,"Brunini, Nani, 1976-","Lisboa : Pato Lógico, 2021",,Literatura Brasileira,087.5(5-10)
978-989-9061-01-9,Tudo tão grande : canção cada vez maior,"Crescer é um mistério. E este livro, seguindo o ritmo das estações e da Natureza, talvez consiga aproximar-nos de uma resposta para esta pergunta: porque ficamos cada vez maiores?? E para esta outra: de onde virá a vontade de crescer??[Resumo da responsabilidade do Plano Nacional de Leitura 2027]",http://catalogolxi.cm-lisboa.pt/images/winlibimg.aspx?skey=&doc=513340&img=56379&res=100&thb=1&pag=1,"Martins, Isabel Minhós, 1974-;Carvalho, Bernardo Pego de, 1973-, il.","Carcavelos : Planeta Tangerina, 2021",,Literatura Portuguesa,087.5(5-10)
978-989-749-133-7,A mensagem secreta de aniversário,"Esta narrativa começa com uma mensagem secreta codificada recebida por Tim, na véspera do seu aniversário, e a personagem vai decifrar o código ao longo das páginas, identificando cada uma das formas, de modo a encontrar o seu presente. A inclusão de recortes e perfurações colabora na descoberta do segredo, o que permite ao leitor acompanhar, ao longo das páginas, o percurso do protagonista.[Resumo da responsabilidade do Plano Nacional de Leitura 2027]",http://catalogolxi.cm-lisboa.pt/images/winlibimg.aspx?skey=&doc=513439&img=56411&res=100&thb=1&pag=1,"Carle, Eric, 1929-2021;Noronha, Ana M., trad.","Matosinhos : Kalandraka, 2021",Livros para sonhar,Literatura Americana,087.5(5-10)
978-989-8868-97-8,Migrantes,"Migrantes, refugiados, deslocados. Órfãos e viúvas, filhas e pais. Um livro silencioso e um poema ilustrado. Onde a coragem e a esperança são a jangada; onde a empatia e o amor são a nossa salvação.[Resumo da responsabilidade do Plano Nacional de Leitura 2027]",http://catalogolxi.cm-lisboa.pt/images/winlibimg.aspx?skey=&doc=513528&img=56434&res=100&thb=1&pag=1,"Watanabe, Issa, 1980-","Lisboa : Orfeu Negro, 2021",Orfeu Mini,Literatura Peruana,087.5(5-10)
978-84-17440-82-4,Tancho,"Inspirada em factos reais - a existência de uma ilha santuário que protege os grous (pássaros de grande significado simbólico e cultural) - a história narra as origens do espaço de proteção das aves, contando como o seu mentor se dedicou a estas aves e à sua proteção, criando as condições para que continuassem a reproduzir-se em segurança. O livro conta ainda com ilustrações que não só complementam o texto, mas ajudam na reconstituição do ambiente onde se passa a história.[Resumo da responsabilidade do Plano Nacional de Leitura 2027]",http://catalogolxi.cm-lisboa.pt/images/winlibimg.aspx?skey=&doc=513530&img=61932&res=100&thb=1&pag=1,"Lozano, Luciano, 1969-;Sacramento, Catarina, 1977-, trad.","Barcelona : Akiara Books, 2021",Akialbum ; 18,Literatura Espanhola,087.5(5-10)
978-989-8868-81-7,"Abril, o peixe vermelho","O Abril é vermelho, muito vermelho. Tem grandes sonhos, mas pouco espaço. O seu maior sonho é fugir, conhecer novos horizontes e dar sentido à vida. Mas como? Talvez com a ajuda do gato lá de casa... Será? O Abril tem um plano e o pobre do gato nem imagina o que lhe vai acontecer![Resumo da responsabilidade do Plano Nacional de Leitura 2027]",http://catalogolxi.cm-lisboa.pt/images/winlibimg.aspx?skey=&doc=513533&img=56438&res=100&thb=1&pag=1,"Leray, Marjolaine, 1984-;Afonso, Maria, 1980-, trad.","Lisboa : Orfeu Negro, 2021",,Literatura Francesa,087.5(5-10)
978-989-749-139-9,Que ossos curiosos!,"Protagonizada por vários esqueletos, humanos e animais, esta narrativa explora uma original combinação entre motivos ligados a uma certa literatura negra e o humor que resulta do recurso a vários tipos de cómico, transformando a experiência de leitura numa atividade particularmente divertida. O texto, caracterizado pelas repetições e paralelismos, é completado por uma ilustração que, apesar dos protagonistas, é mais cómica do que assustadora.[Resumo da responsabilidade do Plano Nacional de Leitura 2027]",http://catalogolxi.cm-lisboa.pt/images/winlibimg.aspx?skey=&doc=513630&img=56461&res=100&thb=1&pag=1,"Ahlberg, Janet, 1944-1994;Ahlberg, Allan, 1938-, co-autor;Almeida, Carla Maia de, 1969-, trad.","Matosinhos : Kalandraka, 2021",Livros para sonhar,Literatura Inglesa,087.5(5-10)
978-972-24-1974-1,O dragão que não gostava de fogo,"O livro conta a história de Mila e do seu processo de descoberta da sua identidade, reconhecendo e valorizando a diferença que a caracteriza em relação aos outros dragões. Depois de tentar tudo para ser como os outros e deixar o pai orgulhoso, Mila descobre que o pai a ama de qualquer forma e só deseja que seja feliz, tal como é. As ilustrações acrescentam detalhes divertidos e afetuosos à história.[Resumo da responsabilidade do Plano Nacional de Leitura 2027]",http://catalogolxi.cm-lisboa.pt/images/winlibimg.aspx?skey=&doc=513703&img=56462&res=100&thb=1&pag=1,"Merino, Gemma;Stilwell, Ana, 1986-, trad.","Lisboa : Livros Horizonte, 2022",Álbuns 58238,Literatura Espanhola,087.5(0-5)
978-989-8888-91-4,Abraças-me?,"Este livro-álbum coloca lado a lado dois mundos paralelos: o dos leitores, vivendo num mundo aparentemente tranquilo, e o das crianças refugiadas, oriundas de contextos marcados pela guerra e pelo sofrimento. Esses mundos têm muitas diferenças, mas também muitas semelhanças, a maioria ligada às rotinas e valores da infância, o relevo dos afetos, da família ou das brincadeiras. Perante esse paralelismo, o leitor é convidado a pensar na resposta que dá ao título do livro: Abraças-me?[Resumo da responsabilidade do Plano Nacional de Leitura 2027]",http://catalogolxi.cm-lisboa.pt/images/winlibimg.aspx?skey=&doc=514004&img=60962&res=100&thb=1&pag=1,"Oliveira, João Borges de, 1978-;Condeço, Sérgio, 1968-, il.","Alcochete : Alfarroba, 2022",,Literatura Portuguesa,087.5(0-5)
978-989-9044-20-3,"O meu urso grande, o meu urso pequeno e eu","O livro conta uma história simples, narrada em primeira pessoa, de um criança que divide o seu afeto por dois ursos, um pequeno e um grande. E se o pequeno está identificado desde a primeira página, associado ao boneco de peluche, o urso grande vai sendo apresentado aos poucos e só é desvendada a sua identidade na última página, o que constitui um jogo narrativo original.[Resumo da responsabilidade do Plano Nacional de Leitura 2027]",http://catalogolxi.cm-lisboa.pt/images/winlibimg.aspx?skey=&doc=514031&img=56567&res=100&thb=1&pag=1,"Mazo, Margarita del, 1960-;Bonilla, Rocio, 1970-, il.","Barcarena : Jacarandá, 2022",,Literatura Espanhola,087.5(0-5)
978-989-749-141-2,Na fila para a arca,"Este álbum parece iniciar-se e desenrolar-se como uma espécie de revisitação do episódio bíblico da Arca de Noé, em resultado de várias alusões e referências intertextuais, presentes desde o título. Contudo, a leitura completa das duas linguagens que formam o livro permitirá descobrir que se trata de uma outra história, ainda que relacionada com a primeira, numa espécie de encaixe metaficcional, onde não falta o humor.[Resumo da responsabilidade do Plano Nacional de Leitura 2027]",http://catalogolxi.cm-lisboa.pt/images/winlibimg.aspx?skey=&doc=514227&img=56633&res=100&thb=1&pag=1,"Papatheodoulou, Antonis, 1977-;Samartzi, Iris, 1979-, il.;Ramos, Elisabete, 1976-, trad.","Matosinhos : Kalandraka, 2021",Livros para sonhar,Literatura Grega,087.5(5-10)
978-989-99708-8-5,"Tão pequenina, tão grande","Funcionando como uma espécie de discurso da criança, este livro dá conta de todas as contradições que caracterizam o complexo (e muito simples) mundo dos afetos familiares, em particular nas relações entre pais e filhos, tomando como perspetiva a da criança, desde o seu nascimento. As noções de pequeno e do grande, que se repetem ao longo do livro, são exploradas em múltiplas aceções e perspetivas, mais literais e mais simbólicas, no livro em que as ilustrações, de grande impacto pela técnica e cor escolhidas, ajudam a equilibrar a dimensão mais lírica do texto.[Resumo da responsabilidade do Plano Nacional de Leitura 2027]",http://catalogolxi.cm-lisboa.pt/images/winlibimg.aspx?skey=&doc=514235&img=56736&res=100&thb=1&pag=1,"Lopes, Maria João;Remédio, Maria, 1983-, il.","[S.l.] : Máquina de Voar, 2021",,Literatura Portuguesa,087.5(0-5)
978-989-749-136-8,Ernesto o elefante,"Inspirada no universo das fábulas tradicionais, a narrativa conta a história de Ernesto, uma pequena cria de elefante, curiosa e aventureira, que resolve explorar o espaço desconhecido da floresta. Fascinado com as descobertas, depressa perde a sua orientação e não consegue ajuda dos grandes animais para reencontrar a mãe. Terá de ser um pequeno rato a ajudar o herói, revelando que a ajuda e a solução para os problemas pode estar onde menos se espera.[Resumo da responsabilidade do Plano Nacional de Leitura 2027]",http://catalogolxi.cm-lisboa.pt/images/winlibimg.aspx?skey=&doc=514246&img=56637&res=100&thb=1&pag=1,"Browne, Anthony, 1946-;Almeida, Carla Maia de, 1969-, trad.","Matosinhos : Kalandraka, 2021",Livros para sonhar,Literatura Inglesa,087.5(5-10)
978-989-564-455-1,O jardim,"""Quando a família da Ema se mudou para a cidade, a Ema queria levar consigo o seu jardim. A mãe disse-lhe que ela podia plantar um novo jardim. Mas não havia espaço, no meio daqueles prédios todos,para macieiras e narciso.(...)"" O Jardim é livro de celebração da amizade, da capacidade de adaptação à mudança, onde o efeito da natureza no nosso espírito, na nossa vida, assim como o contributo que todos podemos dar para o bem estar uns dos outros não é esquecido. Um livro vencedor do Wilderness Society Environment Award for Children’s Literature.[Resumo da responsabilidade do Plano Nacional de Leitura 2027]",http://catalogolxi.cm-lisboa.pt/images/winlibimg.aspx?skey=&doc=514319&img=56816&res=100&thb=1&pag=1,"Walker, Anne;Ferreira, Susana Cardoso, 1972-, trad.","Amadora : Fábula, 2021",,Literatura Australiana,087.5(5-10)
978-989-623-287-0,O Jaime no casamento,"Surgindo como uma espécie de continuidade do volume O Jaime é uma sereia, este novo livro de Jessica Love continua a apostar no tema da valorização da diferença, defendendo uma sociedade mais diversa a todos os níveis, incluindo a dimensão cultural e étnica, mas também a identidade de género e a orientação sexual, entre outras. O afeto é o centro de uma narrativa que é mais contada através de imagens do que texto.[Resumo da responsabilidade do Plano Nacional de Leitura 2027]",http://catalogolxi.cm-lisboa.pt/images/winlibimg.aspx?skey=&doc=514321&img=56772&res=100&thb=1&pag=1,"Love, Jessica;Ferreira, Susana Cardoso, 1972-, trad.","Amadora : Fábula, 2021",,Literatura Americana,087.5(5-10)
978-989-9071-00-1,Tu e Eu e Todos,"Todos gostamos de brincar. Todos comemos e dormimos. Todos sonhamos e rimos.Por vezes, sentimo-nos aborrecidos, temos medo e precisamos de um ombro amigo. Cada um à sua maneira, todos partilhamos experiências e sentimentos. O mais importante é sabermos respeitar-nos e cuidarmos uns dos outros. Um livro que celebra a diversidade e as diferenças.[Resumo da responsabilidade do Plano Nacional de Leitura 2027]",http://catalogolxi.cm-lisboa.pt/images/winlibimg.aspx?skey=&doc=514600&img=56852&res=100&thb=1&pag=1,"Niebius, Maria-Elisabeth;Farina, Marcos, il.;Oliveira, Carla, trad.","Lisboa : Orfeu Negro, 2021",Orfeu Mini,Leitores iniciais,087.5(5-10)
978-972-24-1999-4,A mentira,"A narrativa verbo-icónica conta a história de uma menina que, depois de ter contado uma mentira, se vê presa pelo peso crescente dela, o que não a deixa tranquila e começa a condicionar toda a sua existência. Só a verdade, no final, lhe permite voltar a sentir-se bem, mostrando que todos os problemas têm uma solução.[Resumo da responsabilidade do Plano Nacional de Leitura 2027]",http://catalogolxi.cm-lisboa.pt/images/winlibimg.aspx?skey=&doc=515288&img=56994&res=100&thb=1&pag=1,"Grive, Catherine, 1959-;Bertrand, Frédérique, 1969-, il.","Lisboa : Livros Horizonte, 2021",Álbuns58241,Literatura Francesa,087.5(5-10)
978-972-24-1536-1,Mais lengalengas,,http://catalogolxi.cm-lisboa.pt/images/winlibimg.aspx?skey=&doc=516676&img=57395&res=100&thb=1&pag=1,,,,,
978-989-564-412-4,Como ser um leão,"O livro conta a história de Leonardo, um leão que não se enquadra no paradigma da sua espécie, sendo, por isso, incompreendido pelos outros leões. Gosta de contemplar a natureza e de escrever poesia, revelando-se sensível e fazendo amizades improváveis. Contudo, graças à força das palavras, e com a ajuda da sua amiga pata, Leonardo consegue explicar que há muitas formas de ser um leão e que todos merecem ver a sua identidade respeitada.[Resumo da responsabilidade do Plano Nacional de Leitura 2027]",http://catalogolxi.cm-lisboa.pt/images/winlibimg.aspx?skey=&doc=517871&img=57694&res=100&thb=1&pag=1,"Vere, Ed, 1973-;Ferreira, Susana Cardoso, 1972-, trad.","[S.l.] : Fábula, 2021",,Literatura Inglesa,087.5(5-10)
978-972-21-3090-5,Viagem ao centro do escuro,"O narrador tem sete anos, a irmã cinco. Apesar do seu profundo temor pelo escuro e pelos monstros, o menino parte numa viagem aterradora a pedido da irmã, para levar um monstro perdido para junto dos seus. O medo de um e de outro, na forma como ele os vê, surgem como transfiguração do que cada uma das crianças realmente sente.[Resumo da responsabilidade do Plano Nacional de Leitura 2027]",http://catalogolxi.cm-lisboa.pt/images/winlibimg.aspx?skey=&doc=518907&img=59389&res=100&thb=1&pag=1,"Machado, David, 1978-;Moniz, Madalena, 1985-, il.","Alfragide, : Caminho, 2021",,Literatura Portuguesa,087.5(5-10)
978-989-564-229-8,Aventuras com os piratas : cria a tua própria história de piratas!,"Centrado na temática dos piratas, este volume permite, através da opção entre várias possibilidades narrativas, a construção de um conjunto significativo de histórias diferentes, combinando os elementos que vão surgindo em cada etapa. Destinada a promover a imaginação e a capacidade narrativa dos leitores, sobretudo mais pequenos, o livro integra ainda uma componente visual apelativa.[Resumo da responsabilidade do Plano Nacional de Leitura 2027]",http://catalogolxi.cm-lisboa.pt/images/winlibimg.aspx?skey=&doc=519046&img=63777&res=100&thb=1&pag=1,"Murray, Lily;Murphy, Stef, 1993-, il.","Amadora : Booksmile, 2021",O herói és tu!,Literatura Inglesa,087.5(5-10)
978-989-564-228-1,Aventuras na selva : cria a tua própria aventura na selva!,"Centrado no contexto da selva e das aventuras com animais, este volume permite, através da opção entre várias possibilidades narrativas, a construção de um conjunto significativo de histórias diferentes, combinando os elementos que vão surgindo em cada etapa. Destinada a promover a imaginação e a capacidade narrativa dos leitores, sobretudo mais pequenos, o livro integra ainda uma componente visual apelativa.[Resumo da responsabilidade do Plano Nacional de Leitura 2027]",http://catalogolxi.cm-lisboa.pt/images/winlibimg.aspx?skey=&doc=519048&img=63778&res=100&thb=1&pag=1,"Murray, Lily;Kimpimäki, Essi, il.","Amadora : Booksmile, 2021",O herói és tu!,Literatura Inglesa,087.5(5-10)
978-972-24-2013-6,Grandes jardineiros de pequenos jardins,"Aprender desde criança como cuidar das plantas (semear, plantar, cuidar, ...) e assim criar um pequeno jardim, mesmo dentro de casa, é divertido, saudável e embeleza o ambiente. Este livro ensina como. Com explicações pormenorizadas, dicas muito úteis, e grande diversidade de atividades para realizar com a família, é um guia prático, simples e muito completo, que desenvolve o gosto e o respeito pela natureza. Um livro escrito a pensar nas crianças, mas também importante e útil para os mais crescidos, em especial para os pais.[Resumo da responsabilidade do Plano Nacional de Leitura 2027]",http://catalogolxi.cm-lisboa.pt/images/winlibimg.aspx?skey=&doc=519804&img=58243&res=100&thb=1&pag=1,"Vila Viçosa, Elisabete;Storch, Pau, fotogr.;Thiawe, Laura, il.","Lisboa : Livros Horizonte, 2021",,Jardinagem,087.5:635
978-989-9071-09-4,Issun Bôshi : o polegarzinho,"Inspirada num conto popular japonês, esta é a lenda de Issun Bôshi, o rapaz que não media mais do que um polegar. Um casal de camponeses sonha ter uma criança. Um dia, o milagre acontece e nasce Issun Bôshi, o Polegarzinho. Os anos correm e o menino torna-se esperto e talentoso, mas continua tão pequeno como um polegar. Aos quinze anos decide partir à aventura. Entre peripécias com uma princesa mimada e tropelias com um ogre mal-encarado, o pequeno Issun Bôshi vai encontrar o seu destino.[Resumo da responsabilidade do Plano Nacional de Leitura 2027]",http://catalogolxi.cm-lisboa.pt/images/winlibimg.aspx?skey=&doc=519935&img=59206&res=100&thb=1&pag=1,"Icinori, pseud.;Afonso, Maria, 1980-, trad.","Lisboa : Orfeu Negro, 2021",Orfeu mini,Leitores iniciais,087.5(5-10)
972-750-856-1,As letras falam,,http://catalogolxi.cm-lisboa.pt/images/winlibimg.aspx?skey=&doc=520519&img=58309&res=100&thb=1&pag=1,"Cruz-Contarini, Rafael, 1960-;Suárez, Maribel, il.","Rio de Mouro : Everest, 2003",Montanha Encantada Primeiros Leitores,Leitores iniciais,087.5(5-10)
978-989-784-033-3,O gato e o rato querem sair daqui,"O gato e, depois, mais tarde, o rato descobrem que estão presos dentro de um livro e todos os seus esforços para saírem dele parecem ser em vão. Os leitores são chamados a intervir e a tentar ajudar, inclusive através da manipulação física do livro e das suas páginas, mas os resultados também não são os esperados, pelo que a solução só chega mesmo no final e envolve uma surpresa.[Resumo da responsabilidade do Plano Nacional de Leitura 2027]",http://catalogolxi.cm-lisboa.pt/images/winlibimg.aspx?skey=&doc=520689&img=58500&res=100&thb=1&pag=1,"Jakobs, Günther, 1978-;Gonçalves, Joana, trad.","Lisboa : Nuvem de Letras, 2021",,Literatura Alemã,087.5(5-10)
978-989-564-689-0,Poluir não é fixe,"Quando um menino, Fred, vê um programa de televisão sobre mudança climática, leva muito a sério os perigos evidentes para a Terra e, por isso, decide dedicar-se à missão de contribuir para que o mundo seja um lugar melhor. Ele começa com pequenas ações positivas, divertidas e por vezes hilariantes, mas a mensagem é muito bem compartilhada por outros colegas. Pequenos passos de muitas pessoas resultam em grandes mudanças, exatamente o que é necessário! Uma leitura útil para todos. O livro inclui dicas importantes para ajudar a fazer a diferença.[Resumo da responsabilidade do Plano Nacional de Leitura 2027]",http://catalogolxi.cm-lisboa.pt/images/winlibimg.aspx?skey=&doc=520865&img=58502&res=100&thb=1&pag=1,"Allman, Tim;Shepherd, Nick, il.;Azeredo, Rui, trad.","Amadora : Booksmile, 2021",As aventuras de um eco-miúdo ; 1,Educação Ambiental,087.5:502.17
978-972-24-1986-4,"Três tristes tigres : trava-línguas, piadas e adivinhas","Neste livro reúnem-se textos variados, oriundos ou inspirados pela tradição oral, de diferentes subgéneros, acompanhados de divertidas ilustrações, permitindo o seu acesso fácil por crianças pequenas, com ou sem mediação adulta. Marcados pelo humor, pelas sonoridades e ritmos cativantes, trata-se de textos que podem ser memorizados e cuja repetição tem implicações ao nível do desenvolvimento de múltiplas competências associadas ao desenvolvimento linguístico das crianças.[Resumo da responsabilidade do Plano Nacional de Leitura 2027]",http://catalogolxi.cm-lisboa.pt/images/winlibimg.aspx?skey=&doc=520890&img=58596&res=100&thb=1&pag=1,"Soares, Luísa Ducla, 1939-, compil.;Galindro, Paulo, 1970-, il.","Lisboa : Livros Horizonte, 2021",,Literatura Portuguesa,087.5(5-10)
978-989-8145-68-0,Era uma vez (e muitas outras serão),"Este livro-álbum, dividido em duas partes, propõe aos leitores uma reflexão sobre o tempo e a sua passagem, permitindo perceber como chegámos até aqui, mas também prever o que nos espera no futuro, mais imediato e mais distante, permitindo uma relação mais aprofundada com o que nos rodeia. De forma simples, mas muito original, em resultado do recorte das páginas, o leitor é chamado a pensar o mundo e o seu lugar nele.[Resumo da responsabilidade do Plano Nacional de Leitura 2027]",http://catalogolxi.cm-lisboa.pt/images/winlibimg.aspx?skey=&doc=520924&img=58525&res=100&thb=1&pag=1,"Schaible, Johanna;Martins, Isabel Minhós, 1974-, trad.;Vale, Mariana, trad.","Carcavelos, : Planeta Tangerina, 2021",,,087.5(5-10)
978-989-9071-10-0,A bola vermelha,"Encontrámos uma bola vermelha. De onde veio? E o que será? Um mundo de possibilidades para brincarmos com a imaginação! É vermelha e tem forma de bola. Salta à vista no meio do campo. Será animal ou vegetal? Alguém a perdeu ou terá caído de uma árvore? Uma bola vermelha pode ser muitas coisas! Entre certezas e dúvidas, de AH! a OH!, vamos com ela nesta aventura. IÉÉ! Um álbum simples e belo como um dia de praia, que nos desafia a ver além das aparências e a estar em sintonia com a natureza.[Resumo da responsabilidade do Plano Nacional de Leitura 2027]",http://catalogolxi.cm-lisboa.pt/images/winlibimg.aspx?skey=&doc=521183&img=59442&res=100&thb=1&pag=1,"Starkoff, Vanina, 1981-","Lisboa : Orfeu Negro, 2021",Orfeu Mini,Literatura Argentina,087.5(0-5)
978-989-9071-05-6,A história da Júlia e da sua sombra de menino,"A Júlia não tem modos. A Júlia não é fácil. Uma verdadeira maria-rapaz, queixam-se os pais. Certa manhã, descobre que tem sombra de menino, mas quem acredita nela? Gentil Júlia, para ser amada, deve portar-se como as outras meninas. Gentil Júlia, já não sabe quem é. De rótulos não precisa, mas tão-somente de um abraço. Um álbum original de 1976, provocante, revolucionário e actual, que nos convida a ver pessoas e não estereótipos.[Resumo da responsabilidade do Plano Nacional de Leitura 2027]",http://catalogolxi.cm-lisboa.pt/images/winlibimg.aspx?skey=&doc=521397&img=58772&res=100&thb=1&pag=1,"Bruel, Christian, 1948-;Afonso, Maria, 1980-, trad.","Lisboa : Orfeu Negro, 2021",Orfeu mini,Literatura Francesa,087.5(5-10)
978-972-24-1961-1,Mia e o balão,"Este álbum conta a história de Mia e da relação afetiva que esta estabelece com um balão amarelo, mas acaba por perdê-lo, o que a obriga a lidar com essa perda e, também, com a esperança de o rever. Com muita sensibilidade e subtileza, a narrativa verbo-icónica distingue-se pela sobriedade e contenção, o que imprime mais impacto ainda as palavras e imagens.[Resumo da responsabilidade do Plano Nacional de Leitura 2027]",http://catalogolxi.cm-lisboa.pt/images/winlibimg.aspx?skey=&doc=521407&img=58759&res=100&thb=1&pag=1,"Sakai, Komako, 1966-;Silva, Miguel, trad.","Lisboa : Livros Horizonte, 2021",,Literatura Japonesa,087.5(0-5)
