ISBN,Título,Resumo,Imagem_Lisboa,Autor_Beja,Publicacao_Beja,Colecao_Beja,Assuntos_Beja,CDU_Beja
978-972-20-3127-1,Trava-línguas,,http://catalogolxi.cm-lisboa.pt/images/winlibimg.aspx?skey=&/winlibimg.aspx?skey=&doc=418048&img=27024&res=150&thb=1&pag=1,,,,,
978-972-8781-67-5,Os três bandidos,,http://catalogolxi.cm-lisboa.pt/images/winlibimg.aspx?skey=&/winlibimg.aspx?skey=&doc=339530&img=15494&res=150&thb=1&pag=1,"Ungerer, Jean-Thomas, 1931-2019;Georgieva, Marya, trad.","Lisboa : Kalandraka, 2007",Livros para Sonhar,,087.5(5-10)087.5
978-972-20-5769-1,A garrafa mágica,,http://catalogolxi.cm-lisboa.pt/images/winlibimg.aspx?skey=&/winlibimg.aspx?skey=&doc=418153&img=27210&res=150&thb=1&pag=1,"Rodi, Sara, pseud.;Rodrigues, João, 1976-, il.","Alfragide : D. Quixote, 2024",,Literatura Portuguesa,087.5(5-10)
978-989-55-7961-7,Ciclo da água,,http://catalogolxi.cm-lisboa.pt/images/winlibimg.aspx?skey=&/winlibimg.aspx?skey=&doc=371055&img=11394&res=150&thb=1&pag=1,"Quental, Cristina, 1983-;Magalhães, Mariana, 1971-, co-autor;Serra, Sandra, 1968-, il.","Alfragide : Gailivro, 2017",Onde vamos hoje?,,087.5(5-10)
978-989-95769-1-9,"Kiko, o dentinho de leite",,http://catalogolxi.cm-lisboa.pt/images/winlibimg.aspx?skey=&/winlibimg.aspx?skey=&doc=418345&img=27272&res=150&thb=1&pag=1,"Ribeiro, Manuela Mota;Sá, Mafalda, il.","[Lisboa?] : EBITDA, 2011",,,087.5(0-5)
978-972-659-431-4,O burro Eleutério e o lobo selvagem,,http://catalogolxi.cm-lisboa.pt/images/winlibimg.aspx?skey=&/winlibimg.aspx?skey=&doc=418538&img=27351&res=150&thb=1&pag=1,,,,,
978-989-679-128-5,O jogo das combinações,,http://catalogolxi.cm-lisboa.pt/images/winlibimg.aspx?skey=&/winlibimg.aspx?skey=&doc=418673&img=27404&res=150&thb=1&pag=1,"Tullet, Hervé, 1958-","Lisboa : Edicare, 2012",,,087.5(0-5)
978-989-8775-52-8,A cruzada das crianças : (vamos mudar o mundo),,http://catalogolxi.cm-lisboa.pt/images/winlibimg.aspx?skey=&/winlibimg.aspx?skey=&doc=419598&img=27884&res=150&thb=1&pag=1,"Cruz, Afonso, 1971-","Lisboa : Alfaguara, 2015",,Literatura Portuguesa,087.5(5-10)
978-989-99296-6-1,Antes depois,,http://catalogolxi.cm-lisboa.pt/images/winlibimg.aspx?skey=&/winlibimg.aspx?skey=&doc=420312&img=28509&res=150&thb=1&pag=1,"Ramstein, Anne-Margot;Aregui, Matthias, co-autor;Marques, Ana, trad.","Lisboa : Rodopio de Letras, 2015",,Fundo de Imagem,087.5(5-10)
978-989-8327-54-3,Uma aventura debaixo da terra,,http://catalogolxi.cm-lisboa.pt/images/winlibimg.aspx?skey=&/winlibimg.aspx?skey=&doc=420481&img=28191&res=150&thb=1&pag=1,"Barnett, Mac, 1982-;Klassen, Jon, 1981-, il.;Lopes, Rui, trad.","Lisboa : Orfeu Negro, 2015",Orfeu Mini,,087.5(5-10)
978-989-8327-60-4,O meu irmão invisível,,http://catalogolxi.cm-lisboa.pt/images/winlibimg.aspx?skey=&/winlibimg.aspx?skey=&doc=420527&img=28326&res=150&thb=1&pag=1,"Pez, Ana;Oliveira, Carla, trad.","Lisboa : Orfeu Negro, 2015",Orfeu Mini,,087.5(5-10)
978-972-23-5641-1,O livro sem bonecos,,http://catalogolxi.cm-lisboa.pt/images/winlibimg.aspx?skey=&/winlibimg.aspx?skey=&doc=420556&img=28318&res=150&thb=1&pag=1,"Novak, B. J.","Barcarena : Presença, 2015",,,087.5(5-10)
978-972-21-2071-5,O voo do golfinho,,http://catalogolxi.cm-lisboa.pt/images/winlibimg.aspx?skey=&/winlibimg.aspx?skey=&doc=420727&img=28589&res=150&thb=1&pag=1,,,,,
978-972-751-984-2,A tia e eu,,http://catalogolxi.cm-lisboa.pt/images/winlibimg.aspx?skey=&/winlibimg.aspx?skey=&doc=421140&img=28613&res=150&thb=1&pag=1,"Gonzalez, Maria Teresa Maia, 1958-;Carmo, Inês do, 1968-, il.","Prior Velho : Paulinas, 2009",A minha família e eu,,087.5(5-10)
978-989-99446-4-0,Outono,,http://catalogolxi.cm-lisboa.pt/images/winlibimg.aspx?skey=&doc=421652&img=31911&res=150&thb=1&pag=1,"Letria, André, 1973-","[S.l.] : Pato Lógico, 2017",Desconcertinas,Literatura Portuguesa,087.5(0-5)
978-989-99446-5-7,Partida,,http://catalogolxi.cm-lisboa.pt/images/winlibimg.aspx?skey=&doc=421657&img=31910&res=150&thb=1&pag=1,"Letria, André, 1973-","[S.l.] : Pato Lógico, 2017",Desconcertinas,Literatura Portuguesa,087.5(0-5)
978-989-96717-7-5,Mar : atividário,,http://catalogolxi.cm-lisboa.pt/images/winlibimg.aspx?skey=&/winlibimg.aspx?skey=&doc=422012&img=28928&res=150&thb=1&pag=1,"Henriques, Ricardo, 1976-;Letria, André, 1973-, il.","Lisboa : Pato Lógico, 2013",,ODS 14 - Proteger a Vida Marinha,087.5(5-10)
978-989-20-3765-3,O jantar dos animais,,http://catalogolxi.cm-lisboa.pt/images/winlibimg.aspx?skey=&/winlibimg.aspx?skey=&doc=383174&img=15420&res=150&thb=1&pag=1,"Soares, Luísa Ducla, 1939-;Completo, Cristina, 1965-, il.","Sesimbra : Canto das cores, 2014",Livros para cantar,,087.5(5-10)
978-989-8145-60-4,Com o tempo,,http://catalogolxi.cm-lisboa.pt/images/winlibimg.aspx?skey=&/winlibimg.aspx?skey=&doc=395521&img=25960&res=150&thb=1&pag=1,"Martins, Isabel Minhós, 1974-;Matoso, Madalena, 1974-, il.","Carcavelos : Planeta Tangerina, 2014",,,087.5(0-5)
978-989-8327-62-8,O professor astrogato nas fronteiras do espaço,,http://catalogolxi.cm-lisboa.pt/images/winlibimg.aspx?skey=&/winlibimg.aspx?skey=&doc=422173&img=28963&res=150&thb=1&pag=1,"Walliman, Dominic;Newman, Ben, il.;Quintas, Nuno, trad.","Lisboa : Orfeu Negro, 2015",Orfeu Mini,Astronomia,087.5:523
978-989-97918-4-8,Letras caídas,"A história de um rapaz a quem as letras saltaram, misteriosamente, das páginas de um livro. Tentou resolver o caso com a ajuda do pai, da mãe, do avô, da vizinha da frente, dos colegas da escola e da professora. O tempo foi passando, o rapaz cresceu e, um dia, quando menos esperava, recebeu uma notícia espantosa.[Resumo da responsabilidade do Plano Nacional de Leitura 2027]",http://catalogolxi.cm-lisboa.pt/images/winlibimg.aspx?skey=&/winlibimg.aspx?skey=&doc=422176&img=28935&res=150&thb=1&pag=1,"Cardoso, Inês, 1975-;Brito, Alexandra, 1972-, il.","Braga : AL-Publicações, 2015",,Leitores iniciais,087.5(5-10)
978-989-8688-29-3,Roturas e ligamentos,"Livro-áudio com adivinhas, trava-línguas, lengalengas e contos inspirados pela tradição oral portuguesa. Os textos estão em forma de poema, acompanhados por ilustrações de André da Loba.[Resumo da responsabilidade do Plano Nacional de Leitura 2027]",http://catalogolxi.cm-lisboa.pt/images/winlibimg.aspx?skey=&/winlibimg.aspx?skey=&doc=422731&img=29253&res=150&thb=1&pag=1,"Duarte, Rita Taborda, 1973-;Loba, André da, 1979-, il.","Lisboa : Abysmo, 2016",,Literatura Portuguesa,869.0-1
978-972-0-72687-2,O têpluquê e outras histórias,"Desde a dedicatória à filha Ana até à última narrativa que esta protagoniza, temos um conjunto de textos que sobressaem pela diferença e pelo infinito gozo que as palavras nos dão - uma revolução das letras, as aventuras de um escaravelho contador de histórias, a alegria do pensamento batizado de Abdulum, entre outros.[Resumo da responsabilidade do Plano Nacional de Leitura 2027]",http://catalogolxi.cm-lisboa.pt/images/winlibimg.aspx?skey=&/winlibimg.aspx?skey=&doc=422786&img=29238&res=150&thb=1&pag=1,"Pina, Manuel António, 1943-2012;Dias, Anabela, il.","Porto : Porto, 2013",Educação Literária,,087.5(5-10)
978-989-754-209-1,A viagem de peludim : quem sou? de onde vim? como nasci?,,http://catalogolxi.cm-lisboa.pt/images/winlibimg.aspx?skey=&/winlibimg.aspx?skey=&doc=422931&img=29537&res=150&thb=1&pag=1,"Rodi, Sara, pseud.;Beliz, Vânia, co-autor;Fernandes, Célia, il.","Barcarena : Marcador, 2016",,,087.5(5-10)
972-770-438-7,O tempo,,http://catalogolxi.cm-lisboa.pt/images/winlibimg.aspx?skey=&/winlibimg.aspx?skey=&doc=423456&img=29578&res=150&thb=1&pag=1,"Banqueri, Eduardo;Pedrosa, Maria Amélia, trad.","Lisboa : Plátano, 2006",,,087.5:529
978-972-21-1983-2,Sementes de música para bébés e crianças,,http://catalogolxi.cm-lisboa.pt/images/winlibimg.aspx?skey=&/winlibimg.aspx?skey=&doc=424963&img=30280&res=150&thb=1&pag=1,,,,,
978-972-0-72444-1,Ungali,,http://catalogolxi.cm-lisboa.pt/images/winlibimg.aspx?skey=&/winlibimg.aspx?skey=&doc=425069&img=30302&res=150&thb=1&pag=1,"Serra, Elsa;Flieg, Carlota, il.","Porto : Porto, 2015",,,087.5(5-10)
978-989-665-060-5,História verdadeira e triste de seis homens que procuravam a paz,,http://catalogolxi.cm-lisboa.pt/images/winlibimg.aspx?skey=&/winlibimg.aspx?skey=&doc=425798&img=30552&res=150&thb=1&pag=1,"McKee, David, 1935-2022","Lisboa : Nuvem de Letras, 2016",,,087.5(5-10)
978-989-8195-18-0,História de uma nuvem,,http://catalogolxi.cm-lisboa.pt/images/winlibimg.aspx?skey=&/winlibimg.aspx?skey=&doc=426344&img=30676&res=150&thb=1&pag=1,"Torrado, António, 1939-2021;Clímaco, Tânia, 1982-, ed. lit.","Queluz de Baixo : Soregra, 2009",Ver e ler ; 2,,087.5(5-10)
978-989-749-056-9,Três com Tango,,http://catalogolxi.cm-lisboa.pt/images/winlibimg.aspx?skey=&/winlibimg.aspx?skey=&doc=427671&img=31104&res=150&thb=1&pag=1,"Richardson, Justin, 1963-;Parnell, Peter, 1955-, co-autor;Cole, Henry, 1955-, il.;Alves, Gabriela Rocha, 1959-, trad.","Matosinhos : Kalandraka, 2016",Livros para sonhar,Literatura Americana,087.5(5-10)
978-989-8205-82-7,O sonho de Mateus,,http://catalogolxi.cm-lisboa.pt/images/winlibimg.aspx?skey=&/winlibimg.aspx?skey=&doc=377767&img=13643&res=150&thb=1&pag=1,"Lionni, Leo, 1910-1999","Matosinhos : Kalandraka, 2013",Livros para sonhar,,087.5(0-5)
978-989-8421-20-3,"Tresmalhados mééé [ Registo sonoro ] : um conto de aventuras, outro de amor (partido em dois) e o último é de terror... auditivo : audiolivro","Os títulos destas breves narrativas dramáticas indiciam o seu teor - velhos, animais, dança, amores, noite, comida. Tudo é diferente do considerado normativo.[Resumo da responsabilidade do Plano Nacional de Leitura 2027]",http://catalogolxi.cm-lisboa.pt/images/winlibimg.aspx?skey=&doc=428063&img=61297&res=100&thb=1&pag=1,"Morais, Maria;Morais, Maria, il.","[S.l.] : Boca, 2016",Boca de Cena ; 2 Boca Júnior - para crianças de todas as idades ; 5,,087.5(5-10)
978-989-8166-29-6,O urso que não era,,http://catalogolxi.cm-lisboa.pt/images/winlibimg.aspx?skey=&/winlibimg.aspx?skey=&doc=428477&img=31358&res=150&thb=1&pag=1,"Tashlin, Frank, 1913-1972","Figueira da Foz : Bruaá, 2016",,,087.5(5-10)
978-989-99296-7-8,Na floresta das máscaras,,http://catalogolxi.cm-lisboa.pt/images/winlibimg.aspx?skey=&/winlibimg.aspx?skey=&doc=428523&img=31372&res=150&thb=1&pag=1,"Moreau, Laurent, 1980-;Marques, Ana, trad.","Lisboa : Rodopio de Letras, 2015",,Literatura Francesa,087.5(5-10)
978-989-557-675-3,Ciclo do leite,,http://catalogolxi.cm-lisboa.pt/images/winlibimg.aspx?skey=&doc=429341&img=31538&res=150&thb=1&pag=1,,,,,
978-972-23-3905-6,A chave secreta para o universo,,http://catalogolxi.cm-lisboa.pt/images/winlibimg.aspx?skey=&doc=429342&img=31532&res=150&thb=1&pag=1,"Hawking, Lucy;Hawking, Stephen, 1942-2018, co-autor;Parsons, Garry, il.","Barcarena : Presença, 2008",,Universo,087.5(10-15)
978-989-557-691-3,Brincar às escondidas e outras histórias da Mãe Natureza,,http://catalogolxi.cm-lisboa.pt/images/winlibimg.aspx?skey=&/winlibimg.aspx?skey=&doc=334199&img=26013&res=150&thb=1&pag=1,,,,,
978-972-0-72689-6,"Bichos, bichinhos e bicharocos","[Resumo da responsabilidade do Plano Nacional de Leitura 2027]Oito animais e uma estrelinha dão lugar a outros tantos poemas que esperam uma natural identificação por parte da criança leitora. Alguns são breves histórias exemplares, que divertem e fazem pensar; outros dão-nos o olhar doce e risonho do poeta. Os elementos rítmicos oferecem sonoridades que apontam para uma musicalidade muito especial.",http://catalogolxi.cm-lisboa.pt/images/winlibimg.aspx?skey=&/winlibimg.aspx?skey=&doc=397761&img=20506&res=150&thb=1&pag=1,,,,,
972-650-722-7,As plantas,,,"Marcet, Xavier;Huguet, Marta, il.","Lisboa : Didáctica, 2006",O Meu Primeiro Atlas,,BLANK AUTHORITY TEXT
978-972-650-710-9,Marie Curie,,http://catalogolxi.cm-lisboa.pt/images/winlibimg.aspx?skey=&doc=430188&img=31655&res=150&thb=1&pag=1,"Cugota, Lluís;Vera, Luisa, il.","Lisboa : Didáctica, 2005",Chamo-me,"Curie, Marie, 1867-1934",929
978-972-650-751-2,Atlas básico da água,,http://catalogolxi.cm-lisboa.pt/images/winlibimg.aspx?skey=&doc=430336&img=31694&res=150&thb=1&pag=1,,,,,
978-989-8327-32-1,O meu avô,,http://catalogolxi.cm-lisboa.pt/images/winlibimg.aspx?skey=&/winlibimg.aspx?skey=&doc=394743&img=19400&res=150&thb=1&pag=1,"Sobral, Catarina, 1985-","Lisboa : Orfeu Negro, 2014",,,087.5(5-10)
978-989-8145-72-7,Mana,,http://catalogolxi.cm-lisboa.pt/images/winlibimg.aspx?skey=&doc=434540&img=32785&res=150&thb=1&pag=1,"Estrela, Joana, 1990-","Carcavelos : Planeta tangerina, 2016",,,087.5(5-10)
978-989-8327-69-7,Tão tão grande,,http://catalogolxi.cm-lisboa.pt/images/winlibimg.aspx?skey=&doc=434627&img=32817&res=150&thb=1&pag=1,"Sobral, Catarina, 1985-","Lisboa : Orfeu Negro, 2016",Orfeu Mini,,087.5(5-10)
989-557-024-4,O sonho de Mariana,,http://catalogolxi.cm-lisboa.pt/images/winlibimg.aspx?skey=&doc=435068&img=33429&res=150&thb=1&pag=1,"Mota, António, 1957-;Wojciechowska, Danuta, 1960-, il.","Serzedo : Gailivro, 2008",Biblioteca Pedro e Mariana ; 1,,087.5(5-10)
978-972-24-1817-1,"Drive, uma viagem pela estrada dos opostos",,http://catalogolxi.cm-lisboa.pt/images/winlibimg.aspx?skey=&doc=435170&img=33529&res=150&thb=1&pag=1,"Hatanaka, Kellen, 1987-","Lisboa : Livros Horizonte, 2016",Álbuns ; 58179,Literatura Americana,087.5(0-5)
978-972-9941-07-8,Pê de Pai,,http://catalogolxi.cm-lisboa.pt/images/winlibimg.aspx?skey=&/winlibimg.aspx?skey=&doc=367796&img=10665&res=150&thb=1&pag=1,"Martins, Isabel Minhós, 1974-;Carvalho, Bernardo Pego de, 1973-, il.","São Pedro do Estoril : Planeta Tangerina, 2006",,Estórias sobre os pais,087.5(0-5)
978-989-557-896-2,Ciclo do ovo,,http://catalogolxi.cm-lisboa.pt/images/winlibimg.aspx?skey=&doc=435355&img=33599&res=150&thb=1&pag=1,"Quental, Cristina, 1983-;Magalhães, Mariana, 1971-, co-autor;Serra, Sandra, 1968-, il.","Alfragide : Gailivro, 2011",Onde vamos hoje,Literatura Portuguesa,087.5(5-10)
978-989-98921-0-1,Abrigos,,http://catalogolxi.cm-lisboa.pt/images/winlibimg.aspx?skey=&/winlibimg.aspx?skey=&doc=407739&img=23783&res=150&thb=1&pag=1,"Carvalho, Adélia, 1969-;Remédio, Maria, 1983-, il.","Porto : Tcharan, 2014",,Pré-leitores,087.5(5-10)
978-989-648-771-3,Abissus e o livro que meteu água,"Lucas era um menino de nove anos que adorava a praia e o mar. Um dia estava a passar férias com os pais numa casa junto à praia quando, ao observar o mar com uns binóculos, se sentiu misteriosamente puxado para dentro da água. Deslizou com enorme velocidade e este foi o início de uma proeza incrível que lhe deu a conhecer o que se passa nos oceanos. Na água descobriu um mundo espantoso e um novo amigo que, numa espécie de visita guiada, lhe ensinou coisas extraordinárias. Ler este livro é participar com os dois amigos nessa excecional visita guiada e deixar-se inundar pelas maravilhas aquáticas que existem no fundo do mar.[Resumo da responsabilidade do Plano Nacional de Leitura 2027]",http://catalogolxi.cm-lisboa.pt/images/winlibimg.aspx?skey=&doc=436122&img=33975&res=150&thb=1&pag=1,"Gonzalez, Maria Teresa Maia, 1958-;Benvindo, Pedro, 1987-, il.","Lisboa : Pass, 2016",,Leitores medianos,087.5(10-15)
978-989-749-060-6,As três princesas pálidas,,http://catalogolxi.cm-lisboa.pt/images/winlibimg.aspx?skey=&doc=436993&img=34371&res=150&thb=1&pag=1,"Martín Francés, María José, 1958-;Hénaff, Carole, 1973-, il.;Ramos, Elisabete, 1976-, trad.","Matosinhos : kalandraka, 2016",Livros para sonhar,Literatura Espanhola,087.5(5-10)
978-989-749-067-5,A árvore da escola,,http://catalogolxi.cm-lisboa.pt/images/winlibimg.aspx?skey=&doc=437036&img=34416&res=150&thb=1&pag=1,"Sandoval, Antonio;Urberuaga, Emilio, il.;Ramos, Elisabete, 1976-, trad.","Matosinhos : Kalandraka, 2017",Livros para Sonhar,,087.5(5-10)
978-972-21-2812-4,"Sílvio, guardador de ventos",,http://catalogolxi.cm-lisboa.pt/images/winlibimg.aspx?skey=&doc=437059&img=34422&res=150&thb=1&pag=1,"Mangas, Francisco Duarte, 1960-;Moniz, Madalena, 1985-, il.","Alfragide : Caminho, 2016",,Literatura Portuguesa,087.5(5-10)
978-989-8327-46-8,A minha professora é um monstro!,,http://catalogolxi.cm-lisboa.pt/images/winlibimg.aspx?skey=&doc=437178&img=34471&res=150&thb=1&pag=1,"Brown, Peter, 1979-;Lopes, Rui, trad.","Lisboa : Orfeu Negro, 2014",Orfeu Mini,,087.5(5-10)
978-989-749-064-4,Uma cova é para escavar : o livro das primeiras explicações,,http://catalogolxi.cm-lisboa.pt/images/winlibimg.aspx?skey=&doc=437200&img=34502&res=150&thb=1&pag=1,"krauss, Ruth, 1911-1993;Sendak, Maurice, 1928-2012, il.;Almeida, Carla Maia de, 1969-, trad.","Matosinhos : kalandraka, 2016",Livros para sonhar,Literatura Americana,087.5(5-10)
978-989-8327-79-6,Ahab e a baleia branca,,http://catalogolxi.cm-lisboa.pt/images/winlibimg.aspx?skey=&doc=437288&img=34498&res=150&thb=1&pag=1,"Marsol, Manuel, 1984-;Oliveira, Carla, trad.","Lisboa : Orfeu Negro, 2016",Orfeu Mini,,087.5(5-10)
978-989-23-3087-7,Dicionário das palavras sonhadoras,,http://catalogolxi.cm-lisboa.pt/images/winlibimg.aspx?skey=&doc=437300&img=34524&res=150&thb=1&pag=1,"Mota, António, 1957-;Peixoto, Sebastião, 1972-, ilumin.","Alfragide : Asa, 2015",Obras de António Mota ; 32,,087.5(5-10)
978-972-21-2844-5,O convidador de pirilampos : estórias sem luz elétrica,Perto da Floresta Grande vive um menino e o seu Avô. O menino gosta de cientistar coisas: já inventou um aumentador de caminhos e um convidador de pirilampos. Fala em código Morse com eles. E assim descobre a importância de comunicar com o outro e de o respeitar.[Resumo da responsabilidade do Plano Nacional de Leitura 2027],http://catalogolxi.cm-lisboa.pt/images/winlibimg.aspx?skey=&doc=437389&img=34552&res=150&thb=1&pag=1,"Ondjaki, pseud.;Gonçalves, António Jorge, il.","Alfragide : Caminho, 2017",,Literatura Angolana,087.5(5-10)
978-989-8166-01-2,Eu espero...,,http://catalogolxi.cm-lisboa.pt/images/winlibimg.aspx?skey=&/winlibimg.aspx?skey=&doc=303083&img=2225&res=150&thb=1&pag=1,"Cali, Davide, 1972-;Bloch, Serge, 1956-, il.;Gouveia, Miguel, 1962-, trad.","[S.l.] : Bruaá, 2008",,Literatura Suiça,087.5(0-5)
978-972-21-2835-3,A grande viagem do pequeno Mi,,http://catalogolxi.cm-lisboa.pt/images/winlibimg.aspx?skey=&doc=438354&img=34891&res=150&thb=1&pag=1,"Junqueira, Sandro William, 1974-;Caiano, Rachel, 1977-, il.","Alfragide : Caminho, 2016",,,087.5(5-10)
978-989-749-072-9,Os três porquinhos,"O conto popular dos Três Porquinhos adaptado. As casas são de palha, de madeira e de tijolo. O porquinho mais novo é mais preguiçoso que o irmão do meio; o mais velho é, de todos, o mais ajuizado. O lobo, mau como convém, é castigado, graças à esperteza do Porquinho mais velho e vê-se obrigado a fugir a toda a velocidade. Ficam juntos e felizes os três irmãos...""E, perlimpimpim, esta história chegou ao fim!""[Resumo da responsabilidade do Plano Nacional de Leitura 2027]",http://catalogolxi.cm-lisboa.pt/images/winlibimg.aspx?skey=&doc=438359&img=34885&res=150&thb=1&pag=1,"Ballesteros, Xosé, 1956-;Somà, Marco, 1983-, il.;Ramos, Elisabete, 1976-, trad.","Matosinhos : kalandraka, 2017",Livros para Sonhar,Pré-leitores,087.5(5-10)
978-989-8327-90-1,Aquário,"Numa casa à beira-rio, vive uma menina que todos os dias se deita no cais. Contemplativa, observa os movimentos dos peixes e da água. Até ao dia em que encontra um peixinho vermelho. Entusiasmada, decide logo levá-lo para casa e construir-lhe um mundo aquático maravilhoso. Mas, por fim, percebe que a amizade, para crescer, deve ser livre como as ondas.[Resumo da responsabilidade do Plano Nacional de Leitura 2027]",http://catalogolxi.cm-lisboa.pt/images/winlibimg.aspx?skey=&doc=438538&img=34927&res=150&thb=1&pag=1,"Alonso, Cynthia","Lisboa : Orfeu Negro, 2017",Orfeu mini,Literatura Argentina,087.5(0-5)
978-972-21-1963-4,Uma flor chamada Maria,,http://catalogolxi.cm-lisboa.pt/images/winlibimg.aspx?skey=&/winlibimg.aspx?skey=&doc=423531&img=29646&res=150&thb=1&pag=1,,,,,
978-989-98803-6-8,Quem dá asas às palavras,"15 poemas para a infância onde ecoam as toadas das rimas infantis, do humor e do nonsense a provocar o riso bem-humorado e o prazer de saborear as palavras.[Resumo da responsabilidade do Plano Nacional de Leitura 2027]",http://catalogolxi.cm-lisboa.pt/images/winlibimg.aspx?skey=&doc=439951&img=35385&res=150&thb=1&pag=1,"Soares, Luísa Ducla, 1939-;Carvalho, João Vaz de 1958-, il.","Sesimbra : Canto das cores, 2016",Quem é?,,087.5(5-10)
978-989-557-563-3,Os sapatos do Pai Natal,,http://catalogolxi.cm-lisboa.pt/images/winlibimg.aspx?skey=&/winlibimg.aspx?skey=&doc=401094&img=21647&res=150&thb=1&pag=1,,,,,
978-989-97169-2-6,Quando a mãe era pequena,,http://catalogolxi.cm-lisboa.pt/images/winlibimg.aspx?skey=&doc=440055&img=35402&res=150&thb=1&pag=1,"Cabral, Joana, 1976-;Teixeira, Margarida, il.","[S.l.] : Máquina de Voar, 2016",,,087.5(5-10)
978-989-8145-51-2,Tantos animais e outras lengalengas de contar,,http://catalogolxi.cm-lisboa.pt/images/winlibimg.aspx?skey=&/winlibimg.aspx?skey=&doc=383421&img=15481&res=150&thb=1&pag=1,"Neves, Manuela Castro;Kono, Yara, 1972-, il.","Carcavelos : Planeta tangerina, 2014",,Poesia Infantil,087.5(5-10)
978-989-749-070-5,Uma última carta,,http://catalogolxi.cm-lisboa.pt/images/winlibimg.aspx?skey=&doc=441140&img=35707&res=150&thb=1&pag=1,"Papatheodoulou, Antonis;Samartzi, Iris, 1979-, il.;Ramos, Elisabete, 1976-, trad.","Matosinhos : Kalandraka, 2016",,,087.5(5-10)
978-972-24-1832-4,Faz-de-conta,,http://catalogolxi.cm-lisboa.pt/images/winlibimg.aspx?skey=&doc=441330&img=35737&res=150&thb=1&pag=1,"Cunha, Clara, 1971-;Caiano, Rachel, 1977-, il.","Lisboa : Livros Horizonte, 2017",Álbuns ; 58184,Literatura Portuguesa,087.5(5-10)
978-972-0-72690-2,O rouxinol e a sua namorada,,http://catalogolxi.cm-lisboa.pt/images/winlibimg.aspx?skey=&doc=441341&img=35734&res=150&thb=1&pag=1,"Muralha, Sidónio, 1920-1982;Jacinto, Marta, il.","Porto : Porto, 2013",Educação Literária,,087.5(5-10)
978-972-0-70145-9,Espreita a ciência,,http://catalogolxi.cm-lisboa.pt/images/winlibimg.aspx?skey=&/winlibimg.aspx?skey=&doc=419716&img=27799&res=150&thb=1&pag=1,"Firth, Alex;King, Colin, co-autor","Porto : Porto, 2010",,Ciência,50
978-972-24-1830-0,Cocó : uma história natural (daquilo de que não se fala),"Neste livro, uma zoóloga notável associa-se a um ilustrador divertido para apresentar um guia repleto de factos interessantes sobre o fascinante (e perfumado) mundo de cocô, em várias espécies animais. Os hipopótamos usam-no para se orientarem, as preguiças mantêm-se em contacto através dele, os besouros comem-no...mas nós preferimos não falar dele. No entanto, ele é talvez a coisa mais útil da Terra, aparece em diferentes formas e tamanhos e cada animal tem seu próprio tipo especial. Este é um tema do interesse das crianças e o livro permite-lhes conhecer a história natural de algo que normalmente não é tema fácil de conversa.[Resumo da responsabilidade do Plano Nacional de Leitura 2027]",http://catalogolxi.cm-lisboa.pt/images/winlibimg.aspx?skey=&doc=441514&img=35839&res=150&thb=1&pag=1,"Davies, Nicola, 1958-;Layton, Neal, 1971-, il.;Lopes, Raquel Dutra, 1983-, trad.","Lisboa : Livros Horizonte, 2017",Álbuns 58186,Literatura Inglesa,087.5(5-10)
978-989-8195-41-8,O coelhinho branco,,http://catalogolxi.cm-lisboa.pt/images/winlibimg.aspx?skey=&/winlibimg.aspx?skey=&doc=415630&img=26010&res=150&thb=1&pag=1,"Torrado, António, 1939-2021;Clímaco, Tânia, 1982-, trad.","Queluz de Baixo : Soregra, 2012",Ver e ler ; 5,,087.5(0-5)
978-972-24-1816-4,Feitiços,"Quando um pequeno sapo encontra um livro de feitiços, ousa ter sonhos e ideias, tem de ter muito cuidado! É que nem sempre a magia resulta para os pequenos sapos enfeitiçados pelos contos de fadas...[Resumo da responsabilidade do Plano Nacional de Leitura 2027]",http://catalogolxi.cm-lisboa.pt/images/winlibimg.aspx?skey=&doc=441611&img=35880&res=150&thb=1&pag=1,"Gravett, Emily, 1972-;Stilwell, Ana, 1986-, trad.","[S.l.] : Livros Horizonte, 2016",Álbuns 58177,Leitores iniciais,087.5(5-10)
978-972-21-2122-4,O livro da Tila,,http://catalogolxi.cm-lisboa.pt/images/winlibimg.aspx?skey=&doc=441665&img=35900&res=150&thb=1&pag=1,,,,,
978-972-650-938-7,O grande livro das emoções,,http://catalogolxi.cm-lisboa.pt/images/winlibimg.aspx?skey=&doc=441707&img=35983&res=150&thb=1&pag=1,"Pujol i Pons, Esteve;Alzina, Rafael Bisquerra, co-autor;Arbat Serasols, Carles, 1973-, il.","Didáctica : isboa, 2012",Grandes Livros,,087.5(5-10)
978-972-712-580-7,E tudo acontecia por magia...,,http://catalogolxi.cm-lisboa.pt/images/winlibimg.aspx?skey=&doc=441840&img=36049&res=150&thb=1&pag=1,"Gil, Renata, pseud.;Antunes, Rita, 1973-, il.","Alfragide : NovaGaia, 2010",Letras Nossas,,087.5(5-10)
978-989-8827-70-8,O último livro antes de dormir,"A escolha do último livro antes de dormir é pretexto para a entrada em cena de uma série de personagens dos contos de fadas e de aviso: os Três Porquinhos, a Cinderela, a Capuchinho Vermelho e o Lobo Mau. Como todos eles querem ser as estrelas da história do dia, correm o risco de estragar o livro mas... acabam por fazer um belo trabalho de equipa.[Resumo da responsabilidade do Plano Nacional de Leitura 2027]",http://catalogolxi.cm-lisboa.pt/images/winlibimg.aspx?skey=&doc=442150&img=36226&res=150&thb=1&pag=1,"O'Byrne, Nicola;Santos, Sónia, trad.","Barcarena : Jacarandá, 2017",,Pré-leitores,087.5(5-10)
978-972-20-2942-1,A girafa que comia estrelas,,http://catalogolxi.cm-lisboa.pt/images/winlibimg.aspx?skey=&doc=442181&img=36230&res=150&thb=1&pag=1,,,,,
978-989-707-420-2,Ter uma irmã é...,"O João pensa que ter uma irmã mais nova é uma coisa muito fácil mas o tempo vai ensinar-lhe o contrário. Com sentido de humor, ele vai descrevendo os momentos mais marcantes do desafio.[Resumo da responsabilidade do Plano Nacional de Leitura 2027]",http://catalogolxi.cm-lisboa.pt/images/winlibimg.aspx?skey=&doc=442191&img=36239&res=150&thb=1&pag=1,"Xavier, Lara, 1971-;Galindro, Paulo, 1970-, il.","Amadora : Booksmile, 2017",,Literatura Portuguesa,087.5(5-10)
